jobtitle,company,city,state,country,formattedLocation,source,date,snippet,url,onmousedown,jobkey,sponsored,expired,indeedApply,formattedLocationFull,formattedRelativeTime,noUniqueUrl
"DME and Retail Sales Associate","Women's Health Boutique","Dallas","TX","US","Dallas, TX","Indeed","Fri, 20 Nov 2015 19:42:44 GMT","We are a healthcare retail boutique that specializes in cancer recovery. Searching for a compassionate, high-energy and motivated individual to come work for a...","http://www.indeed.com/viewjob?jk=3bbb7331de4f7707&qd=m1xOB94XTCm6mLs-w7aewTOvHlczHMA9OWh6KD5D6VHKk3pDTyhHp5-2cqd1J3Scbd_EzAfu4daW0PswHQ0EDMXSmLpUnNc6TgruqvNDUaM8TIMAEkUH8PxiEn_8R2TjBY_y8p0WUK9-Zll8go052YiTtx6etCwxwEHXxz5oQKODBfhE8IgzO_q_LQgY-_NZ&indpubnum=4336336693914377&atk=1a7kk72fp50ss805","indeed_clk(this, '6176');","3bbb7331de4f7707","false","false","true","Dallas, TX","30+ days ago","true"
"Retail Merchandiser/Stocking/Warehouse","Acosta","Dallas","TX","US","Dallas, TX","Indeed","Tue, 24 Nov 2015 15:43:08 GMT","The *IMPACT Retail Service Merchandiser*. Is responsible for representing Acosta, our clients, and our customers by effectively performing project work...","http://www.indeed.com/viewjob?jk=f8d694a492ed3d24&qd=m1xOB94XTCm6mLs-w7aewTOvHlczHMA9OWh6KD5D6VHKk3pDTyhHp5-2cqd1J3Scbd_EzAfu4daW0PswHQ0EDMXSmLpUnNc6TgruqvNDUaM8TIMAEkUH8PxiEn_8R2TjBY_y8p0WUK9-Zll8go052YiTtx6etCwxwEHXxz5oQKODBfhE8IgzO_q_LQgY-_NZ&indpubnum=4336336693914377&atk=1a7kk72j953krf6q","indeed_clk(this, '6373');","f8d694a492ed3d24","false","false","true","Dallas, TX","30+ days ago","true"
"Part time Retail Associate","Miele","Dallas","TX","US","Dallas, TX","Miele","Tue, 01 Dec 2015 16:19:26 GMT","Our 11 Experience Centers bring the Miele message and core value of “Forever Better” to life. As our chief brand ambassadors, Experience Center Sales","http://www.indeed.com/viewjob?jk=cda587e260aed0ab&qd=m1xOB94XTCm6mLs-w7aewTOvHlczHMA9OWh6KD5D6VHKk3pDTyhHp5-2cqd1J3Scbd_EzAfu4daW0PswHQ0EDMXSmLpUnNc6TgruqvNDUaM8TIMAEkUH8PxiEn_8R2TjBY_y8p0WUK9-Zll8go052YiTtx6etCwxwEHXxz5oQKODBfhE8IgzO_q_LQgY-_NZ&indpubnum=4336336693914377&atk=1a7kk72j953krf6q","indeed_clk(this, '6373');","cda587e260aed0ab","false","false","false","Dallas, TX","26 days ago","false"
"Retail Store Manager","T-Mobile / GP Mobile","Dallas","TX","US","Dallas, TX","Indeed","Mon, 23 Nov 2015 18:49:29 GMT","Responsible for all operations of a T-Mobile retail store. Primary point of contact for employees of the retail store....","http://www.indeed.com/viewjob?jk=090aa57d29944a84&qd=m1xOB94XTCm6mLs-w7aewTOvHlczHMA9OWh6KD5D6VHKk3pDTyhHp5-2cqd1J3Scbd_EzAfu4daW0PswHQ0EDMXSmLpUnNc6TgruqvNDUaM8TIMAEkUH8PxiEn_8R2TjBY_y8p0WUK9-Zll8go052YiTtx6etCwxwEHXxz5oQKODBfhE8IgzO_q_LQgY-_NZ&indpubnum=4336336693914377&atk=1a7kk72j953krf6q","indeed_clk(this, '6373');","090aa57d29944a84","false","false","true","Dallas, TX","30+ days ago","true"
"Retail Associate Coit Road Tx","Ross Stores","Dallas","TX","US","Dallas, TX","Ross Stores","Wed, 04 Nov 2015 11:35:00 GMT","Ability to perform basic mathematical calculations commonly used in retail environments. The Retail Associate is responsible for ensuring our customers have a...","http://www.indeed.com/viewjob?jk=4fcf3ff5fc84824d&qd=m1xOB94XTCm6mLs-w7aewTOvHlczHMA9OWh6KD5D6VHKk3pDTyhHp5-2cqd1J3Scbd_EzAfu4daW0PswHQ0EDMXSmLpUnNc6TgruqvNDUaM8TIMAEkUH8PxiEn_8R2TjBY_y8p0WUK9-Zll8go052YiTtx6etCwxwEHXxz5oQKODBfhE8IgzO_q_LQgY-_NZ&indpubnum=4336336693914377&atk=1a7kk72j953krf6q","indeed_clk(this, '6373');","4fcf3ff5fc84824d","false","false","false","Dallas, TX","30+ days ago","false"
"Retail Fixture/Merchandise Site Supervisor","J&J Service solutions","Dallas","TX","US","Dallas, TX","Indeed","Thu, 10 Dec 2015 22:26:53 GMT","Our company provides repair, maintenance and installation services to a variety of markets that include Retail, Commercial and Industrial....","http://www.indeed.com/viewjob?jk=1d9ff1e3554bf79f&qd=m1xOB94XTCm6mLs-w7aewTOvHlczHMA9OWh6KD5D6VHKk3pDTyhHp5-2cqd1J3Scbd_EzAfu4daW0PswHQ0EDMXSmLpUnNc6TgruqvNDUaM8TIMAEkUH8PxiEn_8R2TjBY_y8p0WUK9-Zll8go052YiTtx6etCwxwEHXxz5oQKODBfhE8IgzO_q_LQgY-_NZ&indpubnum=4336336693914377&atk=1a7kk72j953krf6q","indeed_clk(this, '6373');","1d9ff1e3554bf79f","false","false","true","Dallas, TX","17 days ago","true"
"Retail Manager","Cowboy Bail Bonds","Dallas","TX","US","Dallas, TX","Cowboy Bail Bonds","Sat, 05 Dec 2015 03:27:22 GMT","Are you a self-starter with the ability and experience to run a retail operation? If you are looking for a dynamic career with tremendous growth opportunities?...","http://www.indeed.com/viewjob?jk=aca73529954029fd&qd=m1xOB94XTCm6mLs-w7aewTOvHlczHMA9OWh6KD5D6VHKk3pDTyhHp5-2cqd1J3Scbd_EzAfu4daW0PswHQ0EDMXSmLpUnNc6TgruqvNDUaM8TIMAEkUH8PxiEn_8R2TjBY_y8p0WUK9-Zll8go052YiTtx6etCwxwEHXxz5oQKODBfhE8IgzO_q_LQgY-_NZ&indpubnum=4336336693914377&atk=1a7kk72j953krf6q","indeed_clk(this, '6373');","aca73529954029fd","false","false","false","Dallas, TX 75207","23 days ago","false"
"Retail Custodial Associate (Part Time)","PetSmart","Dallas","TX","US","Dallas, TX","PetSmart","Mon, 23 Nov 2015 14:26:18 GMT","Description: First impressions are important. Custodial Associates assist in providing a great first impression for our Pet Parents by keeping the store","http://www.indeed.com/viewjob?jk=80b17efee9eabe59&qd=m1xOB94XTCm6mLs-w7aewTOvHlczHMA9OWh6KD5D6VHKk3pDTyhHp5-2cqd1J3Scbd_EzAfu4daW0PswHQ0EDMXSmLpUnNc6TgruqvNDUaM8TIMAEkUH8PxiEn_8R2TjBY_y8p0WUK9-Zll8go052YiTtx6etCwxwEHXxz5oQKODBfhE8IgzO_q_LQgY-_NZ&indpubnum=4336336693914377&atk=1a7kk72j953krf6q","indeed_clk(this, '6373');","80b17efee9eabe59","false","false","false","Dallas, TX","30+ days ago","false"
"Retail Specialist","Andrews Distributing","Dallas","TX","US","Dallas, TX","Andrews Distributing","Wed, 25 Nov 2015 10:20:09 GMT","Retail industry preferred. Performs all other retail specialist duties or special assignments as directed by management....","http://www.indeed.com/viewjob?jk=4d6324e23a0f7e41&qd=m1xOB94XTCm6mLs-w7aewTOvHlczHMA9OWh6KD5D6VHKk3pDTyhHp5-2cqd1J3Scbd_EzAfu4daW0PswHQ0EDMXSmLpUnNc6TgruqvNDUaM8TIMAEkUH8PxiEn_8R2TjBY_y8p0WUK9-Zll8go052YiTtx6etCwxwEHXxz5oQKODBfhE8IgzO_q_LQgY-_NZ&indpubnum=4336336693914377&atk=1a7kk72j953krf6q","indeed_clk(this, '6373');","4d6324e23a0f7e41","false","false","false","Dallas, TX","30+ days ago","false"
"Retail Print Services Supervisor","OfficeMax","Dallas","TX","US","Dallas, TX","Office Depot OfficeMax","Wed, 09 Dec 2015 04:53:26 GMT","Responsibilities: The Print Services Supervisor is a full-time role, and the person in this position will have ownership of the Print Services area. S/he","http://www.indeed.com/viewjob?jk=20029268a172f1b6&qd=m1xOB94XTCm6mLs-w7aewTOvHlczHMA9OWh6KD5D6VHKk3pDTyhHp5-2cqd1J3Scbd_EzAfu4daW0PswHQ0EDMXSmLpUnNc6TgruqvNDUaM8TIMAEkUH8PxiEn_8R2TjBY_y8p0WUK9-Zll8go052YiTtx6etCwxwEHXxz5oQKODBfhE8IgzO_q_LQgY-_NZ&indpubnum=4336336693914377&atk=1a7kk72j953krf6q","indeed_clk(this, '6373');","20029268a172f1b6","false","false","false","Dallas, TX","19 days ago","false"
"Retail Store Manager - The Webb Retail","T-Mobile","Dallas","TX","US","Dallas, TX","T-Mobile","Thu, 10 Dec 2015 12:59:00 GMT","You know retail sales inside and out, and you’re ready to make that next move to a leadership role like no other. Here’s to the leader in you....","http://www.indeed.com/viewjob?jk=1416194e41c3bb51&qd=m1xOB94XTCm6mLs-w7aewTOvHlczHMA9OWh6KD5D6VHKk3pDTyhHp5-2cqd1J3Scbd_EzAfu4daW0PswHQ0EDMXSmLpUnNc6TgruqvNDUaM8TIMAEkUH8PxiEn_8R2TjBY_y8p0WUK9-Zll8go052YiTtx6etCwxwEHXxz5oQKODBfhE8IgzO_q_LQgY-_NZ&indpubnum=4336336693914377&atk=1a7kk72j953krf6q","indeed_clk(this, '6373');","1416194e41c3bb51","false","false","false","Dallas, TX","18 days ago","false"
"Retail Store Shift Supervisor","CVS Health","Dallas","TX","US","Dallas, TX","CVS Health","Fri, 20 Nov 2015 15:48:00 GMT","Hourly Retail, Retail Store Manager. Previous retail experience Education:. As the nation's largest pharmacy health care provider, we offer a wide range of...","http://www.indeed.com/viewjob?jk=70e998f52755330c&qd=m1xOB94XTCm6mLs-w7aewTOvHlczHMA9OWh6KD5D6VHKk3pDTyhHp5-2cqd1J3Scbd_EzAfu4daW0PswHQ0EDMXSmLpUnNc6TgruqvNDUaM8TIMAEkUH8PxiEn_8R2TjBY_y8p0WUK9-Zll8go052YiTtx6etCwxwEHXxz5oQKODBfhE8IgzO_q_LQgY-_NZ&indpubnum=4336336693914377&atk=1a7kk72j953krf6q","indeed_clk(this, '6373');","70e998f52755330c","false","false","false","Dallas, TX","30+ days ago","false"
"Retail Manager & Salesperson Positions","White Horse Vapor","Dallas","TX","US","Dallas, TX","Indeed","Mon, 07 Dec 2015 16:19:53 GMT","RETAIL MANAGERS AND SALES PEOPLE MUST HAVE A PROVEN TRACK RECORD OF SUCCESSFUL RETAIL SALES. RETAIL SALES MANAGERS AND SALESPEOPLE NEEDED IMMEDIATELY!...","http://www.indeed.com/viewjob?jk=92beb5f80664dc58&qd=m1xOB94XTCm6mLs-w7aewTOvHlczHMA9OWh6KD5D6VHKk3pDTyhHp5-2cqd1J3Scbd_EzAfu4daW0PswHQ0EDMXSmLpUnNc6TgruqvNDUaM8TIMAEkUH8PxiEn_8R2TjBY_y8p0WUK9-Zll8go052YiTtx6etCwxwEHXxz5oQKODBfhE8IgzO_q_LQgY-_NZ&indpubnum=4336336693914377&atk=1a7kk72j953krf6q","indeed_clk(this, '6373');","92beb5f80664dc58","false","false","true","Dallas, TX","20 days ago","true"
"Aveda PT Retail Advisor","AVEDA","Dallas","TX","US","Dallas, TX","AVEDA","Wed, 25 Nov 2015 16:42:15 GMT","Candidates must possess the ability to work retail hours including weekends, holidays and special events as needed....","http://www.indeed.com/viewjob?jk=819c3b0528df6e3b&qd=m1xOB94XTCm6mLs-w7aewTOvHlczHMA9OWh6KD5D6VHKk3pDTyhHp5-2cqd1J3Scbd_EzAfu4daW0PswHQ0EDMXSmLpUnNc6TgruqvNDUaM8TIMAEkUH8PxiEn_8R2TjBY_y8p0WUK9-Zll8go052YiTtx6etCwxwEHXxz5oQKODBfhE8IgzO_q_LQgY-_NZ&indpubnum=4336336693914377&atk=1a7kk72j953krf6q","indeed_clk(this, '6373');","819c3b0528df6e3b","false","false","false","Dallas, TX","30+ days ago","false"
"Stock Associate, Frye Retail Dallas, Full Time and Part Time","Global Brands Group","Dallas","TX","US","Dallas, TX","Global Brands Group","Fri, 11 Dec 2015 06:52:41 GMT","Founded in 1863 in Marlboro, Massachusetts by John A. Frye, the Frye Company is the oldest, continuously operating footwear brands in the nation and one of","http://www.indeed.com/viewjob?jk=4fcc919c171132c3&qd=m1xOB94XTCm6mLs-w7aewTOvHlczHMA9OWh6KD5D6VHKk3pDTyhHp5-2cqd1J3Scbd_EzAfu4daW0PswHQ0EDMXSmLpUnNc6TgruqvNDUaM8TIMAEkUH8PxiEn_8R2TjBY_y8p0WUK9-Zll8go052YiTtx6etCwxwEHXxz5oQKODBfhE8IgzO_q_LQgY-_NZ&indpubnum=4336336693914377&atk=1a7kk72j953krf6q","indeed_clk(this, '6373');","4fcc919c171132c3","false","false","false","Dallas, TX","17 days ago","false"
"Lead Retail Consultant","Sprint","Dallas","TX","US","Dallas, TX","Sprint","Wed, 02 Dec 2015 21:33:23 GMT","A Lead Retail Consultant. One year of Retail Sales or related experience. A Sprint Retail Sales opportunity connects you to a job that matters....","http://www.indeed.com/viewjob?jk=a2756b6449bb46b3&qd=m1xOB94XTCm6mLs-w7aewTOvHlczHMA9OWh6KD5D6VHKk3pDTyhHp5-2cqd1J3Scbd_EzAfu4daW0PswHQ0EDMXSmLpUnNc6TgruqvNDUaM8TIMAEkUH8PxiEn_8R2TjBY_y8p0WUK9-Zll8go052YiTtx6etCwxwEHXxz5oQKODBfhE8IgzO_q_LQgY-_NZ&indpubnum=4336336693914377&atk=1a7kk72j953krf6q","indeed_clk(this, '6373');","a2756b6449bb46b3","false","false","false","Dallas, TX","25 days ago","false"
"Experienced Professional Medical Software Salesperson","Maximum Health Concepts","Dallas","TX","US","Dallas, TX","Maximum Health Concepts","Thu, 17 Dec 2015 06:22:07 GMT","Market a turnkey chronic care management software solution to physicians We are seeking medical salespeople to independently rep a software solution which","http://www.indeed.com/viewjob?jk=ba64c10c5696ed2b&qd=m1xOB94XTCm6mLs-w7aewTOvHlczHMA9OWh6KD5D6VHKk3pDTyhHp5-2cqd1J3Scbd_EzAfu4daW0PswHQ0EDMXSmLpUnNc6TgruqvNDUaM8TIMAEkUH8PxiEn_8R2TjBY_y8p0WUK9-Zll8go052YiTtx6etCwxwEHXxz5oQKODBfhE8IgzO_q_LQgY-_NZ&indpubnum=4336336693914377&atk=1a7kk72j953krf6q","indeed_clk(this, '6373');","ba64c10c5696ed2b","false","false","false","Dallas, TX","11 days ago","false"
"PHARMACY TECHNICIAN @ CUH RETAIL PHARMACY","UT Southwestern Medical Center - Dallas","Dallas","TX","US","Dallas, TX","UT Southwestern Medical Center - Dallas","Wed, 09 Dec 2015 12:04:10 GMT","This is FT pharmacy techcician's position in the CUH Retail Pharmacy which supports discharge patients from InPatient and ED....","http://www.indeed.com/viewjob?jk=7fde5a1d4fdaa983&qd=m1xOB94XTCm6mLs-w7aewTOvHlczHMA9OWh6KD5D6VHKk3pDTyhHp5-2cqd1J3Scbd_EzAfu4daW0PswHQ0EDMXSmLpUnNc6TgruqvNDUaM8TIMAEkUH8PxiEn_8R2TjBY_y8p0WUK9-Zll8go052YiTtx6etCwxwEHXxz5oQKODBfhE8IgzO_q_LQgY-_NZ&indpubnum=4336336693914377&atk=1a7kk72j953krf6q","indeed_clk(this, '6373');","7fde5a1d4fdaa983","false","false","false","Dallas, TX","19 days ago","false"
"Retail Kiosk","Camille Albane Galleria","Dallas","TX","US","Dallas, TX","Indeed","Thu, 05 Nov 2015 19:07:22 GMT","*Dallas Galleria Kiosk now hiring friendly sales associates for part-time or full-time positions.* *Location* : Dallas Galleria *Description: * Selling","http://www.indeed.com/viewjob?jk=fd60fbf5b6040456&qd=m1xOB94XTCm6mLs-w7aewTOvHlczHMA9OWh6KD5D6VHKk3pDTyhHp5-2cqd1J3Scbd_EzAfu4daW0PswHQ0EDMXSmLpUnNc6TgruqvNDUaM8TIMAEkUH8PxiEn_8R2TjBY_y8p0WUK9-Zll8go052YiTtx6etCwxwEHXxz5oQKODBfhE8IgzO_q_LQgY-_NZ&indpubnum=4336336693914377&atk=1a7kk72j953krf6q","indeed_clk(this, '6373');","fd60fbf5b6040456","false","false","true","Dallas, TX","30+ days ago","true"
"Retail Associate South Dallas TX","Ross Stores","Dallas","TX","US","Dallas, TX","Ross Stores","Wed, 04 Nov 2015 11:35:00 GMT","Ability to perform basic mathematical calculations commonly used in retail environments. The Retail Associate is responsible for ensuring our customers have a...","http://www.indeed.com/viewjob?jk=eab953bb91ef34d4&qd=m1xOB94XTCm6mLs-w7aewTOvHlczHMA9OWh6KD5D6VHKk3pDTyhHp5-2cqd1J3Scbd_EzAfu4daW0PswHQ0EDMXSmLpUnNc6TgruqvNDUaM8TIMAEkUH8PxiEn_8R2TjBY_y8p0WUK9-Zll8go052YiTtx6etCwxwEHXxz5oQKODBfhE8IgzO_q_LQgY-_NZ&indpubnum=4336336693914377&atk=1a7kk72j953krf6q","indeed_clk(this, '6373');","eab953bb91ef34d4","false","false","false","Dallas, TX","30+ days ago","false"
"Retail Team Lead","Teavana","Dallas","TX","US","Dallas, TX","Teavana","Fri, 20 Nov 2015 11:26:28 GMT","Previous retail experience (1 year). Demonstrated ability to sell and increase sales in a retail environment. Team Lead, Operations &amp; Visual....","http://www.indeed.com/viewjob?jk=45f02b71fb1f2183&qd=m1xOB94XTCm6mLs-w7aewTOvHlczHMA9OWh6KD5D6VHKk3pDTyhHp5-2cqd1J3Scbd_EzAfu4daW0PswHQ0EDMXSmLpUnNc6TgruqvNDUaM8TIMAEkUH8PxiEn_8R2TjBY_y8p0WUK9-Zll8go052YiTtx6etCwxwEHXxz5oQKODBfhE8IgzO_q_LQgY-_NZ&indpubnum=4336336693914377&atk=1a7kk72j953krf6q","indeed_clk(this, '6373');","45f02b71fb1f2183","false","false","false","Dallas, TX","30+ days ago","false"
"Retail Merchandiser","SPAR Business Services","Dallas","TX","US","Dallas, TX","Indeed","Tue, 24 Nov 2015 16:33:21 GMT","*SPAR Business Services, Inc. has opportunities for ongoing merchandising work* *Project Description* : Part-time, on-going work servicing a wide-variety of...","http://www.indeed.com/viewjob?jk=72beeb5c4aea2ad5&qd=m1xOB94XTCm6mLs-w7aewTOvHlczHMA9OWh6KD5D6VHKk3pDTyhHp5-2cqd1J3Scbd_EzAfu4daW0PswHQ0EDMXSmLpUnNc6TgruqvNDUaM8TIMAEkUH8PxiEn_8R2TjBY_y8p0WUK9-Zll8go052YiTtx6etCwxwEHXxz5oQKODBfhE8IgzO_q_LQgY-_NZ&indpubnum=4336336693914377&atk=1a7kk72j953krf6q","indeed_clk(this, '6373');","72beeb5c4aea2ad5","false","false","true","Dallas, TX","30+ days ago","true"
"McKinsey Solutions - Periscope Client Development, Retail","McKinsey & Company","Dallas","TX","US","Dallas, TX","McKinsey & Company","Mon, 16 Nov 2015 13:46:35 GMT","Retail background in pricing, promotions and assortment preferred. Demonstrated experience working in core Retail sector with industry leaders....","http://www.indeed.com/viewjob?jk=420dcf40ea24fe93&qd=m1xOB94XTCm6mLs-w7aewTOvHlczHMA9OWh6KD5D6VHKk3pDTyhHp5-2cqd1J3Scbd_EzAfu4daW0PswHQ0EDMXSmLpUnNc6TgruqvNDUaM8TIMAEkUH8PxiEn_8R2TjBY_y8p0WUK9-Zll8go052YiTtx6etCwxwEHXxz5oQKODBfhE8IgzO_q_LQgY-_NZ&indpubnum=4336336693914377&atk=1a7kk72j953krf6q","indeed_clk(this, '6373');","420dcf40ea24fe93","false","false","false","Dallas, TX","30+ days ago","false"
"Director of Retail (not for profit)","Goodwill Industries of Dallas, Inc;","Dallas","TX","US","Dallas, TX","Indeed","Wed, 09 Dec 2015 18:19:36 GMT","Multi Unit Retail management, supervisory, Management, Retail Hard and Soft Lines:. Prepare an operating budget for the Retail department....","http://www.indeed.com/viewjob?jk=c19f22bd83400c56&qd=m1xOB94XTCm6mLs-w7aewTOvHlczHMA9OWh6KD5D6VHKk3pDTyhHp5-2cqd1J3Scbd_EzAfu4daW0PswHQ0EDMXSmLpUnNc6TgruqvNDUaM8TIMAEkUH8PxiEn_8R2TjBY_y8p0WUK9-Zll8go052YiTtx6etCwxwEHXxz5oQKODBfhE8IgzO_q_LQgY-_NZ&indpubnum=4336336693914377&atk=1a7kk72j953krf6q","indeed_clk(this, '6373');","c19f22bd83400c56","false","false","true","Dallas, TX","18 days ago","true"
"Retail Sales-Fashion (Dallas)","Shinola","Dallas","TX","US","Dallas, TX","Shinola","Tue, 10 Nov 2015 19:56:36 GMT","Retail Sales Associates are key to our success. Shinola is searching for entrepreneurial minded individuals ready to join our dynamic and revolutionary retail...","http://www.indeed.com/viewjob?jk=8064452aaac562d0&qd=m1xOB94XTCm6mLs-w7aewTOvHlczHMA9OWh6KD5D6VHKk3pDTyhHp5-2cqd1J3Scbd_EzAfu4daW0PswHQ0EDMXSmLpUnNc6TgruqvNDUaM8TIMAEkUH8PxiEn_8R2TjBY_y8p0WUK9-Zll8go052YiTtx6etCwxwEHXxz5oQKODBfhE8IgzO_q_LQgY-_NZ&indpubnum=4336336693914377&atk=1a7kk72j953krf6q","indeed_clk(this, '6373');","8064452aaac562d0","false","false","false","Dallas, TX","30+ days ago","false"
"Route Salesperson-Shoemobile Rep – Dallas TX – Class A required","W.W. Grainger Inc","Dallas","TX","US","Dallas, TX","W.W. Grainger","Tue, 01 Dec 2015 20:56:50 GMT","Salesperson will drive mobile shoe store (45' tractor-trailer) to industrial customer job sites on pre-scheduled appointments to service company safety shoe...","http://www.indeed.com/viewjob?jk=a909b96fce198437&qd=m1xOB94XTCm6mLs-w7aewTOvHlczHMA9OWh6KD5D6VHKk3pDTyhHp5-2cqd1J3Scbd_EzAfu4daW0PswHQ0EDMXSmLpUnNc6TgruqvNDUaM8TIMAEkUH8PxiEn_8R2TjBY_y8p0WUK9-Zll8go052YiTtx6etCwxwEHXxz5oQKODBfhE8IgzO_q_LQgY-_NZ&indpubnum=4336336693914377&atk=1a7kk72j953krf6q","indeed_clk(this, '6373');","a909b96fce198437","false","false","false","Dallas, TX","26 days ago","true"
"Lucky Brand #20: Seasonal Retail Career Opportunities - Dallas, TX","Lucky Brand Jeans","Dallas","TX","US","Dallas, TX","Lucky Brand Jeans","Tue, 10 Nov 2015 18:22:56 GMT","The brand also produces apparel, shoes, accessories and jewelry for men and women that are sold at 248 retail stores (and counting) within the U.S., high-end...","http://www.indeed.com/viewjob?jk=598497b2a609496d&qd=m1xOB94XTCm6mLs-w7aewTOvHlczHMA9OWh6KD5D6VHKk3pDTyhHp5-2cqd1J3Scbd_EzAfu4daW0PswHQ0EDMXSmLpUnNc6TgruqvNDUaM8TIMAEkUH8PxiEn_8R2TjBY_y8p0WUK9-Zll8go052YiTtx6etCwxwEHXxz5oQKODBfhE8IgzO_q_LQgY-_NZ&indpubnum=4336336693914377&atk=1a7kk72mk5u51ccq","indeed_clk(this, '6483');","598497b2a609496d","false","false","false","Dallas, TX","30+ days ago","false"
"Retail Sales Associate","PLANET BLUE","Dallas","TX","US","Dallas, TX","Indeed","Tue, 10 Nov 2015 05:05:24 GMT","At least 3-5 years retail experience with strong customer service background. Making Waves Since 1995*....","http://www.indeed.com/viewjob?jk=c452255bf122cd6a&qd=m1xOB94XTCm6mLs-w7aewTOvHlczHMA9OWh6KD5D6VHKk3pDTyhHp5-2cqd1J3Scbd_EzAfu4daW0PswHQ0EDMXSmLpUnNc6TgruqvNDUaM8TIMAEkUH8PxiEn_8R2TjBY_y8p0WUK9-Zll8go052YiTtx6etCwxwEHXxz5oQKODBfhE8IgzO_q_LQgY-_NZ&indpubnum=4336336693914377&atk=1a7kk72mk5u51ccq","indeed_clk(this, '6483');","c452255bf122cd6a","false","false","true","Dallas, TX","30+ days ago","true"
"Retail Sales Lead - Dallas, TX (North Park) Job","Oakley","Dallas","TX","US","Dallas, TX","Oakley","Sun, 06 Dec 2015 06:12:38 GMT","1+ years of retail sales experience within a specialty environment. All retail associates may use available back room seating when the nature of the work...","http://www.indeed.com/viewjob?jk=b0ee15144be25863&qd=m1xOB94XTCm6mLs-w7aewTOvHlczHMA9OWh6KD5D6VHKk3pDTyhHp5-2cqd1J3Scbd_EzAfu4daW0PswHQ0EDMXSmLpUnNc6TgruqvNDUaM8TIMAEkUH8PxiEn_8R2TjBY_y8p0WUK9-Zll8go052YiTtx6etCwxwEHXxz5oQKODBfhE8IgzO_q_LQgY-_NZ&indpubnum=4336336693914377&atk=1a7kk72mk5u51ccq","indeed_clk(this, '6483');","b0ee15144be25863","false","false","false","Dallas, TX","22 days ago","false"
"RETAIL REP-PT","CROSSMARK","Dallas","TX","US","Dallas, TX","Crossmark","Thu, 19 Nov 2015 23:48:29 GMT","Executes retail merchandising tasks as scheduled. Prior retail experience is preferred, but not required....","http://www.indeed.com/viewjob?jk=4994e2dd4db2e4b8&qd=m1xOB94XTCm6mLs-w7aewTOvHlczHMA9OWh6KD5D6VHKk3pDTyhHp5-2cqd1J3Scbd_EzAfu4daW0PswHQ0EDMXSmLpUnNc6TgruqvNDUaM8TIMAEkUH8PxiEn_8R2TjBY_y8p0WUK9-Zll8go052YiTtx6etCwxwEHXxz5oQKODBfhE8IgzO_q_LQgY-_NZ&indpubnum=4336336693914377&atk=1a7kk72mk5u51ccq","indeed_clk(this, '6483');","4994e2dd4db2e4b8","false","false","false","Dallas, TX","30+ days ago","false"
"Retail Associate Dallas Tx Dds","Ross Stores","Dallas","TX","US","Dallas, TX","Ross Stores","Mon, 26 Oct 2015 23:51:00 GMT","Ability to perform basic mathematical calculations commonly used in retail environments. The Retail Associate is responsible for ensuring our customers have a...","http://www.indeed.com/viewjob?jk=6306e988edcb3d0f&qd=m1xOB94XTCm6mLs-w7aewTOvHlczHMA9OWh6KD5D6VHKk3pDTyhHp5-2cqd1J3Scbd_EzAfu4daW0PswHQ0EDMXSmLpUnNc6TgruqvNDUaM8TIMAEkUH8PxiEn_8R2TjBY_y8p0WUK9-Zll8go052YiTtx6etCwxwEHXxz5oQKODBfhE8IgzO_q_LQgY-_NZ&indpubnum=4336336693914377&atk=1a7kk72mk5u51ccq","indeed_clk(this, '6483');","6306e988edcb3d0f","false","false","false","Dallas, TX","30+ days ago","false"
"Oracle retail Business analyst","ANR Consulting Inc","Dallas","TX","US","Dallas, TX","Indeed","Wed, 09 Dec 2015 23:17:03 GMT","Business Analyst Oracle retail*. 5 Plus years of experience as Business Analyst with experience in Retail Industry....","http://www.indeed.com/viewjob?jk=917465f90c3279b4&qd=m1xOB94XTCm6mLs-w7aewTOvHlczHMA9OWh6KD5D6VHKk3pDTyhHp5-2cqd1J3Scbd_EzAfu4daW0PswHQ0EDMXSmLpUnNc6TgruqvNDUaM8TIMAEkUH8PxiEn_8R2TjBY_y8p0WUK9-Zll8go052YiTtx6etCwxwEHXxz5oQKODBfhE8IgzO_q_LQgY-_NZ&indpubnum=4336336693914377&atk=1a7kk72mk5u51ccq","indeed_clk(this, '6483');","917465f90c3279b4","false","false","true","Dallas, TX","18 days ago","true"
"Retail Associate Forest Lane","Ross Stores","Dallas","TX","US","Dallas, TX","Ross Stores","Wed, 04 Nov 2015 11:35:00 GMT","Ability to perform basic mathematical calculations commonly used in retail environments. The Retail Associate is responsible for ensuring our customers have a...","http://www.indeed.com/viewjob?jk=2999f667aa72b7fe&qd=m1xOB94XTCm6mLs-w7aewTOvHlczHMA9OWh6KD5D6VHKk3pDTyhHp5-2cqd1J3Scbd_EzAfu4daW0PswHQ0EDMXSmLpUnNc6TgruqvNDUaM8TIMAEkUH8PxiEn_8R2TjBY_y8p0WUK9-Zll8go052YiTtx6etCwxwEHXxz5oQKODBfhE8IgzO_q_LQgY-_NZ&indpubnum=4336336693914377&atk=1a7kk72mk5u51ccq","indeed_clk(this, '6483');","2999f667aa72b7fe","false","false","false","Dallas, TX","30+ days ago","false"
"Retail Team Member","Teavana","Dallas","TX","US","Dallas, TX","Teavana","Fri, 20 Nov 2015 11:21:45 GMT","Retail Team Member. Ability to sell and increase sales in a retail environment. Job Summary and Mission:....","http://www.indeed.com/viewjob?jk=fb22f95945ad8487&qd=m1xOB94XTCm6mLs-w7aewTOvHlczHMA9OWh6KD5D6VHKk3pDTyhHp5-2cqd1J3Scbd_EzAfu4daW0PswHQ0EDMXSmLpUnNc6TgruqvNDUaM8TIMAEkUH8PxiEn_8R2TjBY_y8p0WUK9-Zll8go052YiTtx6etCwxwEHXxz5oQKODBfhE8IgzO_q_LQgY-_NZ&indpubnum=4336336693914377&atk=1a7kk72mk5u51ccq","indeed_clk(this, '6483');","fb22f95945ad8487","false","false","false","Dallas, TX","30+ days ago","false"
"Retail Sales Associate","Drytech Cleaners","Dallas","TX","US","Dallas, TX","Indeed","Thu, 12 Nov 2015 23:53:35 GMT","_*DryTech Cleaners*_ looking for a flexible counter/cashier Experienced preferred but not required, we are willing to train the right candidate. pay day would","http://www.indeed.com/viewjob?jk=b6d8efbccd9f8b96&qd=m1xOB94XTCm6mLs-w7aewTOvHlczHMA9OWh6KD5D6VHKk3pDTyhHp5-2cqd1J3Scbd_EzAfu4daW0PswHQ0EDMXSmLpUnNc6TgruqvNDUaM8TIMAEkUH8PxiEn_8R2TjBY_y8p0WUK9-Zll8go052YiTtx6etCwxwEHXxz5oQKODBfhE8IgzO_q_LQgY-_NZ&indpubnum=4336336693914377&atk=1a7kk72mk5u51ccq","indeed_clk(this, '6483');","b6d8efbccd9f8b96","false","false","true","Dallas, TX 75201","30+ days ago","true"
"IMPACT Retail Service Merchandiser","Acosta Sales & Marketing","Dallas","TX","US","Dallas, TX","Acosta Sales & Marketing","Wed, 02 Dec 2015 23:05:00 GMT","Have a working knowledge of merchandising and retail terminology. Refrigerated and freezer sections of retail stores) for limited periods of time....","http://www.indeed.com/viewjob?jk=0b50f1f6934707e3&qd=m1xOB94XTCm6mLs-w7aewTOvHlczHMA9OWh6KD5D6VHKk3pDTyhHp5-2cqd1J3Scbd_EzAfu4daW0PswHQ0EDMXSmLpUnNc6TgruqvNDUaM8TIMAEkUH8PxiEn_8R2TjBY_y8p0WUK9-Zll8go052YiTtx6etCwxwEHXxz5oQKODBfhE8IgzO_q_LQgY-_NZ&indpubnum=4336336693914377&atk=1a7kk72mk5u51ccq","indeed_clk(this, '6483');","0b50f1f6934707e3","false","false","false","Dallas, TX","25 days ago","false"
"Retail Merchandiser- Part Time","TNG Retail Services","Dallas","TX","US","Dallas, TX","TNG Retail Services","Fri, 06 Nov 2015 22:34:47 GMT","The main retail merchandiser responsibilities include implementing plan-o-grams, visual merchandising, product....","http://www.indeed.com/viewjob?jk=125257ae258d890d&qd=m1xOB94XTCm6mLs-w7aewTOvHlczHMA9OWh6KD5D6VHKk3pDTyhHp5-2cqd1J3Scbd_EzAfu4daW0PswHQ0EDMXSmLpUnNc6TgruqvNDUaM8TIMAEkUH8PxiEn_8R2TjBY_y8p0WUK9-Zll8go052YiTtx6etCwxwEHXxz5oQKODBfhE8IgzO_q_LQgY-_NZ&indpubnum=4336336693914377&atk=1a7kk72mk5u51ccq","indeed_clk(this, '6483');","125257ae258d890d","false","false","false","Dallas, TX","30+ days ago","false"
